unigram;n...2;bigram;n...4;trigram;n...6;quadgram;n...8
lavoro;57;smart working;26;lavoro da casa;13;lavoro in smart working;4
casa;31;da casa;20;in smart working;12;26 è praticamente chiuso;3
smart;27;in smart;13;non è cambiato; 6;art 26 è praticamente;3
working;27;lavoro da;13;lavoro in smart; 4;chiuso trattando solo gli;3
molto;21;di lavoro; 9;26 è praticamente; 3;è praticamente chiuso trattando;3
attività;17;è cambiato; 8;art 26 è; 3;ex art 26 è;3
clienti;12;a casa; 7;chiuso trattando solo; 3;il reparto ex art;3
posso;11;lavoro in; 7;è praticamente chiuso; 3;in smart working da;3
solo;11;non è; 7;ex art 26; 3;praticamente chiuso trattando solo;3
covid; 9;non posso; 7;il reparto ex; 3;reparto ex art 26;3
cambiato; 8;con il; 6;praticamente chiuso trattando; 3;smart working da casa;3
lezioni; 8;in ufficio; 6;reparto ex art; 3;trattando solo gli indifferibili;3
diminuito; 7;a distanza; 5;smart working da; 3;a causa di incontri;2
lavorare; 7;attività di; 4;smart working e; 3;causa di incontri interpersonali;2
pazienti; 7;clienti e; 4;solo gli indifferibili; 3;la mia attività lavorativa;2
prima; 7;con clienti; 4;trattando solo gli; 3;non è cambiato molto;2
lavorativa; 6;il lavoro; 4;working da casa; 3;rallentato a causa di;2
poco; 6;lavoro a; 4;a causa di; 2;100 delle ore lavorative;1
ufficio; 6;26 è; 3;causa di incontri; 2;12 ore al giorno;1
computer; 5;a causa; 3;che non posso; 2;13 eventuale smart working;1
distanza; 5;al computer; 3;con clienti e; 2;3 studio solo prestazioni;1
laboratorio; 5;art 26; 3;delle ore lavorative; 2;4 3 studio solo;1
meno; 5;attività lavorativa; 3;di incontri interpersonali; 2;50 tempo in smart;1
personale; 5;chiuso trattando; 3;dispositivi di protezione; 2;6 alle 13 eventuale;1
quasi; 5;di protezione; 3;è cambiato molto; 2;a ambiente confinato casa;1
ridotto; 5;e i; 3;è diventato molto; 2;a casa altrimenti le;1
sempre; 5;è praticamente; 3;in termini di; 2;a casa con il;1
andare; 4;è stata; 3;incontri con clienti; 2;a casa e smart;1
aumentato; 4;ex art; 3;la mia attività; 2;a casa in smart;1
aumento; 4;gli indifferibili; 3;lavoro a casa; 2;a casa prima quasi;1
call; 4;i clienti; 3;lavoro di ricerca; 2;a causa delle lezioni;1
chiuso; 4;il mio; 3;lo smart working; 2;a dettagli prima irrilevanti;1
cliente; 4;il reparto; 3;mia attività lavorativa; 2;a distanza dei collaboratori;1
colleghi; 4;in modo; 3;non posso andare; 2;a distanza e al;1
contatto; 4;la mia; 3;non posso più; 2;a far capire alle;1
difficoltà; 4;lavoro di; 3;per attività di; 2;a gestire il lavoro;1
dispositivi; 4;lavoro su; 3;rallentato a causa; 2;a giorni alterni mascherina;1
dpi; 4;non lavoro; 3;tutto in smart; 2;a lavorare da casa;1
incontri; 4;on line; 3;100 delle ore; 1;a protezione sul banco;1
meeting; 4;per la; 3;12 ore al; 1;a quanto facessimo prima;1
numero; 4;praticamente chiuso; 3;13 eventuale smart; 1;a quelli del ne;1
ora; 4;quasi sempre; 3;3 studio solo; 1;a trasferita a casa;1
ore; 4;reparto ex; 3;4 3 studio; 1;a visita o sono;1
paziente; 4;se non; 3;50 tempo in; 1;abbiamo drasticamente ridotto il;1
protezione; 4;solo gli; 3;6 alle 13; 1;abbiamo istallato un divisorio;1
remoto; 4;trattando solo; 3;a ambiente confinato; 1;abbiamo preso tutte le;1
stato; 4;tutte le; 3;a casa altrimenti; 1;abbiamo ridotto gli interventi;1
svolgere; 4;working da; 3;a casa con; 1;accedere continuativamente alle attrezzature;1
totalmente; 4;working e; 3;a casa e; 1;access to the laboratory;1
26; 3;a lavorare; 2;a casa in; 1;ad eventuali lezioni o;1
art; 3;al giorno; 2;a casa prima; 1;ad individuare eventuali pz;1
attenzione; 3;al lavoro; 2;a causa delle; 1;ad internet e di;1
causa; 3;al paziente; 2;a dettagli prima; 1;adeguato anche al lavoro;1
difficile; 3;andare in; 2;a distanza dei; 1;aggiornamenti e corsi molto;1
diventato; 3;attività e; 2;a distanza e; 1;ai bimbi e occuparsi;1
ex; 3;attività non; 2;a far capire; 1;ai paziente malati covid;1
ferie; 3;cambiato molto; 2;a gestire il; 1;ai vari strumenti di;1
guanti; 3;casa in; 2;a giorni alterni; 1;al di là del;1
incontrare; 3;casa prima; 2;a lavorare da; 1;al giorno andare in;1
indifferibili; 3;causa di; 2;a lezioni telematiche; 1;al lavoro locale se;1
interventi; 3;che non; 2;a nuovo ordine; 1;al lavoro su computer;1
l'attività; 3;che posso; 2;a portare avanti; 1;al passato con la;1
l’attività; 3;con colleghi; 2;a protezione sul; 1;al paziente è cambiato;1
lavorative; 3;con i; 2;a quanto facessimo; 1;al paziente per aumento;1
limitato; 3;con la; 2;a quelli del; 1;al telefono niente visite;1
line; 3;conference call; 2;a trasferita a; 1;alcune attività che non;1
malati; 3;contatto con; 2;a visita o; 1;alcuni progetti anche da;1
modo; 3;delle lezioni; 2;abbiamo drasticamente ridotto; 1;all'estero dove ho delle;1
molte; 3;delle ore; 2;abbiamo istallato un; 1;all’inizio smart working poi;1
molti; 3;di incontri; 2;abbiamo preso tutte; 1;alla contagiosità per i;1
nessun; 3;di ricerca; 2;abbiamo ridotto gli; 1;alle 13 eventuale smart;1
on; 3;di supporto; 2;accedere continuativamente alle; 1;alle persone l’educazione civica;1
online; 3;difficoltà a; 2;access to the; 1;alternanza del personale distanziamento;1
organizzazione; 3;dispositivi di; 2;ad eventuali lezioni; 1;alterni mascherina vetro guanti;1
parte; 3;diventato molto; 2;ad individuare eventuali; 1;altra regione di tesidenza;1
persone; 3;e di; 2;ad internet e; 1;altri da vetri di;1
possiamo; 3;è diminuito; 2;adeguato anche al; 1;altrimenti le mie attività;1
praticamente; 3;è diventato; 2;aggiornamenti e corsi; 1;altro aspetto che è;1
presenza; 3;e lavoro; 2;ai bimbi e; 1;ambiente sociale scuola a;1
pz; 3;è limitato; 2;ai paziente malati; 1;anche al lavoro locale;1
reparto; 3;e molto; 2;ai vari strumenti; 1;anche da vetro perché;1
rispetto; 3;e non; 2;al di là; 1;anche la formazione da;1
riunioni; 3;e stato; 2;al giorno andare; 1;anche perché localizzate in;1
stata; 3;è stato; 2;al giorno circa; 1;anche precedentemetne al covid19;1
stress; 3;ferie forzate; 2;al lavoro locale; 1;ancora blindati e altri;1
studio; 3;gli interventi; 2;al lavoro su; 1;andare all'estero dove ho;1
supporto; 3;ho dovuto; 2;al passato con; 1;andare dai miei clienti;1
telefono; 3;ho iniziato; 2;al paziente è; 1;andare in bagno o;1
totale; 3;i dpi; 2;al paziente per; 1;andare in ufficio ma;1
trattando; 3;i pz; 2;al telefono niente; 1;annullate la maggior parte;1
tutte; 3;il numero; 2;alcune attività che; 1;annullato ero in stage;1
vetro; 3;in cantiere; 2;alcuni progetti anche; 1;anticontagio suggerite dal governo;1
ambiente; 2;in laboratorio; 2;all'attività prettamente clinica; 1;any experiment works which;1
annullato; 2;in presenza; 2;all'estero dove ho; 1;approccio al paziente per;1
attivita; 2;in termini; 2;all’inizio smart working; 1;appuntamento attività di smart;1
aumentata; 2;incontri con; 2;alla contagiosità per; 1;aspetto che è cambiato;1
aziende; 2;incontri interpersonali; 2;alle 13 eventuale; 1;assaggiare il mio caffè;1
cambiamenti; 2;internet e; 2;alle attrezzature lavorative; 1;assenza contatto pazienti teleconsulti;1
cannot; 2;interventi chirurgici; 2;alle persone l’educazione; 1;assistenza ai paziente malati;1
cantiere; 2;l’attività di; 2;alternanza del personale; 1;attenti ad individuare eventuali;1
carico; 2;la stagione; 2;alterni mascherina vetro; 1;attenzione a dettagli prima;1
chirurgici; 2;lavoro al; 2;altra regione di; 1;attenzione alla contagiosità per;1
chiusa; 2;lavoro con; 2;altri da vetri; 1;attenzione verso i pz;1
clinica; 2;lavoro molto; 2;altrimenti le mie; 1;attivato home working per;1
collaboratori; 2;le precauzioni; 2;altro aspetto che; 1;attivazione mezzi di mediazione;1
conference; 2;le urgenze; 2;ambiente confinato casa; 1;attività che non posso;1
confronti; 2;lo smart; 2;ambiente sociale scuola; 1;attività chiusa il 4;1
così; 2;malati covid; 2;ambulatori non necessari; 1;attività di comunicazione telefonica;1
didattica; 2;meeting virtuali; 2;anche al lavoro; 1;attività di laboratorio faccio;1
differenza; 2;mi sono; 2;anche da vetro; 1;attività di smart working;1
diminuita; 2;mia attività; 2;anche la formazione; 1;attività e proseguito da;1
distanziamento; 2;miei clienti; 2;anche perché localizzate; 1;attività fisica in casa;1
diversa; 2;mio lavoro; 2;anche precedentemetne al; 1;attivita in studio sospesa;1
dobbiamo; 2;non covid; 2;ancora blindati e; 1;attività lavorativa si svolgeva;1
dovuto; 2;non più; 2;andare all'estero dove; 1;attività lavorativa sul territorio;1
eventi; 2;non possiamo; 2;andare dai miei; 1;attività non si riescono;1
eventuali; 2;non potendo; 2;andare in bagno; 1;attività non sono cambiate;1
far; 2;non vado; 2;andare in ufficio; 1;attualmente è diminuito inquanto;1
fare; 2;numero di; 2;andavo in ufficio; 1;aumentata attività lavorativa sul;1
fisica; 2;ore lavorative; 2;annullate la maggior; 1;aumentata la difficoltà di;1
forzate; 2;per attività; 2;annullato ero in; 1;aumentate i meeting on;1
gestione; 2;per il; 2;annullato il contratto; 1;aumentati i turni notturni;1
giorni; 2;per le; 2;anticontagio suggerite dal; 1;aumentato impegno giornaliero per;1
giorno; 2;per ora; 2;any experiment works; 1;aumentato le precauzioni nel;1
impegno; 2;posso andare; 2;approccio al paziente; 1;aumentato lo stress per;1
iniziato; 2;posso incontrare; 2;appuntamento attività di; 1;aumento casi covid aumento;1
interazione; 2;posso più; 2;aspetto che è; 1;aumento del carico soprattutto;1
internet; 2;posso svolgere; 2;assaggiare il mio; 1;aumento dell’orario di lavoro;1
interpersonali; 2;rallentato a; 2;assenza contatto pazienti; 1;aumento improvviso carica di;1
lavoriamo; 2;ridotto il; 2;assistenza ai paziente; 1;avessi avuti non avrei;1
lezione; 2;sono a; 2;attenti ad individuare; 1;avevo richiesto lo smart;1
limitata; 2;sono in; 2;attenzione a dettagli; 1;avuti non avrei potuto;1
locale; 2;sono stati; 2;attenzione alla contagiosità; 1;azienda con un ridotto;1
maggior; 2;strumenti di; 2;attenzione verso i; 1;aziende anche perché localizzate;1
maggiore; 2;termini di; 2;attivato home working; 1;aziende tramite meeting virtuali;1
mascherina; 2;tutto in; 2;attivazione mezzi di; 1;azzersto ma seguo aggiornamenti;1
modalità; 2;100 delle; 1;attività che non; 1;bagno o bere un;1
occuparsi; 2;12 ore; 1;attività chiusa il; 1;bambini a casa altrimenti;1
orario; 2;13 eventuale; 1;attività di comunicazione; 1;banco disinfettiamo tutto quello;1
passato; 2;3 studio; 1;attività di coordinamento; 1;be performed in the;1
pc; 2;4 3; 1;attività di laboratorio; 1;ben 12 ore al;1
pochi; 2;50 tempo; 1;attività di smart; 1;bere un bicchiere d'acqua;1
possibile; 2;6 alle; 1;attività e priorità; 1;bicchiere d'acqua oppure soffiarsi;1
potendo; 2;a ambiente; 1;attività e proseguito; 1;bimbi e occuparsi di;1
precauzioni; 2;a dettagli; 1;attività fisica in; 1;blindati e altri da;1
problema; 2;a far; 1;attività in presenza; 1;call annullate la maggior;1
radicalmente; 2;a gestire; 1;attivita in studio; 1;call molta difficoltà a;1
rallentato; 2;a giorni; 1;attività lavorativa si; 1;call molto lavoro al;1
ricerca; 2;a lezioni; 1;attività lavorativa sul; 1;cambiamenti o problemi sono;1
riduzione; 2;a nuovo; 1;attività non si; 1;cambiamenti organizzativi rapidi in;1
seguo; 2;a portare; 1;attività non sono; 1;cambiata organizzazione dell intera;1
smartworking; 2;a protezione; 1;attualmente è diminuito; 1;cambiate molto grazie ai;1
sociale; 2;a quanto; 1;aumentata attività lavorativa; 1;cambiato è che ora;1
solamente; 2;a quelli; 1;aumentata la difficoltà; 1;cambiato lavoravo in smart;1
sospesa; 2;a studio; 1;aumentate i meeting; 1;cambiato molto perché io;1
sospeso; 2;a trasferita; 1;aumentati i turni; 1;cambiato perché dobbiamo rispettare;1
sostanzialmente; 2;a visita; 1;aumentato impegno giornaliero; 1;cannot access to the;1
sperimentale; 2;abbiamo drasticamente; 1;aumentato le precauzioni; 1;cannot do any experiment;1
stagione; 2;abbiamo istallato; 1;aumentato lo stress; 1;cantiere i collaboratori sono;1
stare; 2;abbiamo preso; 1;aumento casi covid; 1;cantiere solo se indispensabili;1
stati; 2;abbiamo ridotto; 1;aumento del carico; 1;cantieri fermi tante conference;1
stravolto; 2;accedere continuativamente; 1;aumento dell’orario di; 1;capire alle persone l’educazione;1
strumenti; 2;access to; 1;aumento improvviso carica; 1;cardiovascolari siamo in pochi;1
studenti; 2;ad eventuali; 1;avessi avuti non; 1;carico soprattutto in termini;1
tempo; 2;ad individuare; 1;avevo richiesto lo; 1;casa altrimenti le mie;1
termini; 2;ad internet; 1;avrei potuto lavorare; 1;casa come se fossi;1
the; 2;adeguato anche; 1;avuti non avrei; 1;casa con il computer;1
tramite; 2;adesso cig; 1;azienda con un; 1;casa e smart working;1
turni; 2;aggiornamenti e; 1;aziende anche perché; 1;casa in maniera molto;1
tuttavia; 2;ai bimbi; 1;aziende tramite meeting; 1;casa in smart working;1
urgenze; 2;ai paziente; 1;azzersto ma seguo; 1;casa limitata nella parte;1
usando; 2;ai vari; 1;bagno o bere; 1;casa mandandogli programmazioni e;1
uso; 2;al covid19; 1;bambini a casa; 1;casa nonostante sia molto;1
vado; 2;al di; 1;banco disinfettiamo tutto; 1;casa partecipo online ad;1
varie; 2;al passato; 1;be performed in; 1;casa prima andavo in;1
via; 2;al pc; 1;ben 12 ore; 1;casa prima quasi sempre;1
video; 2;al telefono; 1;bere un bicchiere; 1;casa universita chiusa meeting;1
virtuali; 2;alcune attività; 1;bicchiere d'acqua oppure; 1;casi covid aumento improvviso;1
visite; 2;alcuni progetti; 1;bimbi e occuparsi; 1;causa delle lezioni da;1
100; 1;all'attività prettamente; 1;blindati e altri; 1;centro hub per le;1
12; 1;all'estero dove; 1;call annullate la; 1;chat whatsapp per gli;1
13; 1;all’inizio smart; 1;call molta difficoltà; 1;che dimezzato fatturato dei;1
3; 1;alla contagiosità; 1;call molto lavoro; 1;che è cambiato è;1
4; 1;alle 13; 1;cambiamenti o problemi; 1;che ho iniziato una;1
50; 1;alle attrezzature; 1;cambiamenti organizzativi rapidi; 1;che impatta in modo;1
6; 1;alle persone; 1;cambiata organizzazione dell; 1;che lavoro al pc;1
abbastanza; 1;alternanza del; 1;cambiate molto grazie; 1;che non posso incontrare;1
accedere; 1;alterni mascherina; 1;cambiato è che; 1;che non posso svolgere;1
access; 1;altra regione; 1;cambiato lavoravo in; 1;che ora lavoro con;1
adeguato; 1;altri da; 1;cambiato molto perché; 1;che però può essere;1
adesso; 1;altrimenti le; 1;cambiato perché dobbiamo; 1;che posso fare al;1
aggiornamenti; 1;altro aspetto; 1;cannot access to; 1;che posso simulare quasi;1
alcune; 1;ambiente confinato; 1;cannot do any; 1;che prima erano svolte;1
alcuni; 1;ambiente sociale; 1;cantiere i collaboratori; 1;che riducono la visibilità;1
all'attività; 1;ambulatori non; 1;cantiere solo se; 1;che vengono a visita;1
all'emergenza; 1;anche al; 1;cantieri fermi tante; 1;che viene toccato da;1
all'estero; 1;anche da; 1;capire alle persone; 1;chiaramente diminuito per la;1
all’inizio; 1;anche la; 1;cardiovascolari siamo in; 1;chirurgici giornalieri nello specifico;1
alternanza; 1;anche perché; 1;carica di lavoro; 1;chirurgici programmati e gli;1
alterni; 1;anche precedentemetne; 1;carico di lavoro; 1;chiusa il 4 3;1
